{
  "$schema": "https://json-schema.org/draft/2020-12/schema",
  "$id": "https://shortsmith.local/schemas/editorial-video/research-dossier.schema.json",
  "title": "Editorial research dossier",
  "type": "object",
  "additionalProperties": false,
  "required": [
    "version",
    "episodeId",
    "topic",
    "selectedCluster",
    "sources",
    "claims",
    "dataAssets",
    "entities",
    "timeline",
    "contradictions",
    "unknowns",
    "editorialWarnings",
    "generatedAt"
  ],
  "properties": {
    "version": {
      "const": 1
    },
    "episodeId": {
      "$ref": "#/$defs/episodeId"
    },
    "topic": {
      "type": "string",
      "minLength": 3,
      "maxLength": 240
    },
    "selectedCluster": {
      "type": "object",
      "additionalProperties": false,
      "required": [
        "id",
        "title",
        "sourceRefs",
        "score",
        "reasons"
      ],
      "properties": {
        "id": {
          "$ref": "#/$defs/id"
        },
        "title": {
          "type": "string",
          "minLength": 1,
          "maxLength": 300
        },
        "sourceRefs": {
          "$ref": "#/$defs/idList"
        },
        "score": {
          "type": "number",
          "minimum": 0,
          "maximum": 100
        },
        "reasons": {
          "type": "array",
          "minItems": 1,
          "maxItems": 20,
          "items": {
            "type": "string",
            "minLength": 1,
            "maxLength": 300
          }
        }
      }
    },
    "sources": {
      "type": "array",
      "minItems": 1,
      "maxItems": 50,
      "items": {
        "type": "object",
        "additionalProperties": false,
        "required": [
          "id",
          "title",
          "publisher",
          "canonicalUrl",
          "publishedAt",
          "sourceHash",
          "status"
        ],
        "properties": {
          "id": {
            "$ref": "#/$defs/id"
          },
          "title": {
            "type": "string",
            "minLength": 1,
            "maxLength": 300
          },
          "publisher": {
            "type": "string",
            "minLength": 1,
            "maxLength": 160
          },
          "canonicalUrl": {
            "type": "string",
            "maxLength": 2048,
            "pattern": "^(?:https://|fixture://)[^\\s]+$"
          },
          "publishedAt": {
            "oneOf": [
              {
                "$ref": "#/$defs/timestamp"
              },
              {
                "type": "null"
              }
            ]
          },
          "sourceHash": {
            "$ref": "#/$defs/sha256"
          },
          "status": {
            "enum": [
              "ready",
              "incomplete",
              "excluded",
              "error"
            ]
          }
        }
      }
    },
    "claims": {
      "type": "array",
      "minItems": 1,
      "maxItems": 500,
      "items": {
        "type": "object",
        "additionalProperties": false,
        "required": [
          "id",
          "statement",
          "type",
          "sourceRefs",
          "dataRefs",
          "effectiveAt",
          "confidence",
          "status",
          "notes"
        ],
        "properties": {
          "id": {
            "$ref": "#/$defs/id"
          },
          "statement": {
            "type": "string",
            "minLength": 1,
            "maxLength": 1000
          },
          "type": {
            "enum": [
              "fact",
              "interpretation",
              "opinion",
              "numeric",
              "causal",
              "context"
            ]
          },
          "sourceRefs": {
            "$ref": "#/$defs/idList"
          },
          "dataRefs": {
            "type": "array",
            "uniqueItems": true,
            "items": {
              "$ref": "#/$defs/id"
            }
          },
          "effectiveAt": {
            "oneOf": [
              {
                "$ref": "#/$defs/timestamp"
              },
              {
                "type": "null"
              }
            ]
          },
          "confidence": {
            "type": "number",
            "minimum": 0,
            "maximum": 1
          },
          "status": {
            "enum": [
              "supported",
              "disputed",
              "context-only",
              "unsupported",
              "stale"
            ]
          },
          "notes": {
            "type": "string",
            "maxLength": 2000
          }
        }
      }
    },
    "dataAssets": {
      "type": "array",
      "maxItems": 100,
      "items": {
        "type": "object",
        "additionalProperties": false,
        "required": [
          "id",
          "kind",
          "sourceUrl",
          "provider",
          "retrievedAt",
          "timezone",
          "frequency",
          "unit",
          "currency",
          "columns",
          "range",
          "localFile",
          "sha256",
          "license",
          "status"
        ],
        "properties": {
          "id": {
            "$ref": "#/$defs/id"
          },
          "kind": {
            "enum": [
              "series",
              "table",
              "snapshot",
              "chart-image"
            ]
          },
          "sourceUrl": {
            "type": "string",
            "maxLength": 2048,
            "pattern": "^(?:https://|fixture://)[^\\s]+$"
          },
          "provider": {
            "type": "string",
            "minLength": 1,
            "maxLength": 160
          },
          "retrievedAt": {
            "$ref": "#/$defs/timestamp"
          },
          "timezone": {
            "type": "string",
            "minLength": 1,
            "maxLength": 80
          },
          "frequency": {
            "type": "string",
            "minLength": 1,
            "maxLength": 80
          },
          "unit": {
            "type": "string",
            "minLength": 1,
            "maxLength": 80
          },
          "currency": {
            "type": [
              "string",
              "null"
            ],
            "pattern": "^[A-Z]{3}$"
          },
          "columns": {
            "type": "array",
            "minItems": 1,
            "uniqueItems": true,
            "items": {
              "type": "string",
              "minLength": 1,
              "maxLength": 120
            }
          },
          "range": {
            "type": "object",
            "additionalProperties": false,
            "required": [
              "start",
              "end"
            ],
            "properties": {
              "start": {
                "type": "string",
                "minLength": 1,
                "maxLength": 80
              },
              "end": {
                "type": "string",
                "minLength": 1,
                "maxLength": 80
              }
            }
          },
          "localFile": {
            "$ref": "#/$defs/relativePath"
          },
          "sha256": {
            "$ref": "#/$defs/sha256"
          },
          "license": {
            "type": "string",
            "minLength": 1,
            "maxLength": 240
          },
          "status": {
            "enum": [
              "confirmed",
              "proposed",
              "rejected"
            ]
          }
        }
      }
    },
    "entities": {
      "type": "array",
      "maxItems": 200,
      "items": {
        "type": "object",
        "additionalProperties": false,
        "required": [
          "id",
          "name",
          "type"
        ],
        "properties": {
          "id": {
            "$ref": "#/$defs/id"
          },
          "name": {
            "type": "string",
            "minLength": 1,
            "maxLength": 160
          },
          "type": {
            "type": "string",
            "minLength": 1,
            "maxLength": 80
          },
          "aliases": {
            "type": "array",
            "uniqueItems": true,
            "items": {
              "type": "string",
              "minLength": 1,
              "maxLength": 160
            }
          }
        }
      }
    },
    "timeline": {
      "type": "array",
      "maxItems": 200,
      "items": {
        "type": "object",
        "additionalProperties": false,
        "required": [
          "at",
          "label",
          "claimRefs",
          "sourceRefs"
        ],
        "properties": {
          "at": {
            "$ref": "#/$defs/timestamp"
          },
          "label": {
            "type": "string",
            "minLength": 1,
            "maxLength": 400
          },
          "claimRefs": {
            "$ref": "#/$defs/idList"
          },
          "sourceRefs": {
            "$ref": "#/$defs/idList"
          }
        }
      }
    },
    "contradictions": {
      "type": "array",
      "maxItems": 100,
      "items": {
        "type": "object",
        "additionalProperties": false,
        "required": [
          "id",
          "claimRefs",
          "summary",
          "status"
        ],
        "properties": {
          "id": {
            "$ref": "#/$defs/id"
          },
          "claimRefs": {
            "$ref": "#/$defs/idList"
          },
          "summary": {
            "type": "string",
            "minLength": 1,
            "maxLength": 1000
          },
          "status": {
            "enum": [
              "open",
              "explained",
              "resolved-by-source"
            ]
          }
        }
      }
    },
    "unknowns": {
      "$ref": "#/$defs/messageList"
    },
    "editorialWarnings": {
      "$ref": "#/$defs/messageList"
    },
    "generatedAt": {
      "$ref": "#/$defs/timestamp"
    }
  },
  "$defs": {
    "id": {
      "type": "string",
      "pattern": "^[a-z][a-z0-9-]{2,95}$"
    },
    "episodeId": {
      "type": "string",
      "pattern": "^episode-[a-z0-9][a-z0-9-]{7,95}$"
    },
    "idList": {
      "type": "array",
      "minItems": 1,
      "uniqueItems": true,
      "items": {
        "$ref": "#/$defs/id"
      }
    },
    "messageList": {
      "type": "array",
      "maxItems": 100,
      "items": {
        "type": "string",
        "minLength": 1,
        "maxLength": 1000
      }
    },
    "timestamp": {
      "type": "string",
      "pattern": "^\\d{4}-\\d{2}-\\d{2}T\\d{2}:\\d{2}:\\d{2}(?:\\.\\d{3})?Z$"
    },
    "sha256": {
      "type": "string",
      "pattern": "^[a-f0-9]{64}$"
    },
    "relativePath": {
      "type": "string",
      "minLength": 1,
      "maxLength": 500,
      "pattern": "^(?![A-Za-z]:[\\\\/])(?![\\\\/])(?!.*(?:^|[\\\\/])\\.\\.(?:[\\\\/]|$)).+$"
    }
  }
}
